No.     Time        Source                Destination           Protocol Info
      1 0.000000    192.168.1.3           192.168.1.2           TCP      45393 > 7910 [SYN] Seq=0 Win=5840 Len=0 MSS=1460 SACK_PERM=1 TSV=4242754 TSER=0 WS=7

Frame 1: 74 bytes on wire (592 bits), 74 bytes captured (592 bits)
Ethernet II, Src: Usi_14:7f:23 (e0:2a:82:14:7f:23), Dst: Elitegro_f8:d7:51 (00:19:21:f8:d7:51)
Internet Protocol, Src: 192.168.1.3 (192.168.1.3), Dst: 192.168.1.2 (192.168.1.2)
Transmission Control Protocol, Src Port: 45393 (45393), Dst Port: 7910 (7910), Seq: 0, Len: 0
    Source port: 45393 (45393)
    Destination port: 7910 (7910)
    [Stream index: 0]
    Sequence number: 0    (relative sequence number)
    Header length: 40 bytes
    Flags: 0x02 (SYN)
    Window size: 5840
    Checksum: 0x8384 [validation disabled]
    Options: (20 bytes)
        Maximum segment size: 1460 bytes
        TCP SACK Permitted Option: True
        Timestamps: TSval 4242754, TSecr 0
        NOP
        Window scale: 7 (multiply by 128)

No.     Time        Source                Destination           Protocol Info
      2 0.002176    192.168.1.2           192.168.1.3           TCP      7910 > 45393 [SYN, ACK] Seq=0 Ack=1 Win=5792 Len=0 MSS=1460 SACK_PERM=1 TSV=4626387 TSER=4242754 WS=7

Frame 2: 74 bytes on wire (592 bits), 74 bytes captured (592 bits)
Ethernet II, Src: Elitegro_f8:d7:51 (00:19:21:f8:d7:51), Dst: Usi_14:7f:23 (e0:2a:82:14:7f:23)
Internet Protocol, Src: 192.168.1.2 (192.168.1.2), Dst: 192.168.1.3 (192.168.1.3)
Transmission Control Protocol, Src Port: 7910 (7910), Dst Port: 45393 (45393), Seq: 0, Ack: 1, Len: 0
    Source port: 7910 (7910)
    Destination port: 45393 (45393)
    [Stream index: 0]
    Sequence number: 0    (relative sequence number)
    Acknowledgement number: 1    (relative ack number)
    Header length: 40 bytes
    Flags: 0x12 (SYN, ACK)
    Window size: 5792
    Checksum: 0x3d20 [validation disabled]
    Options: (20 bytes)
        Maximum segment size: 1460 bytes
        TCP SACK Permitted Option: True
        Timestamps: TSval 4626387, TSecr 4242754
        NOP
        Window scale: 7 (multiply by 128)
    [SEQ/ACK analysis]

No.     Time        Source                Destination           Protocol Info
      3 0.002209    192.168.1.3           192.168.1.2           TCP      45393 > 7910 [ACK] Seq=1 Ack=1 Win=5888 Len=0 TSV=4242754 TSER=4626387

Frame 3: 66 bytes on wire (528 bits), 66 bytes captured (528 bits)
Ethernet II, Src: Usi_14:7f:23 (e0:2a:82:14:7f:23), Dst: Elitegro_f8:d7:51 (00:19:21:f8:d7:51)
Internet Protocol, Src: 192.168.1.3 (192.168.1.3), Dst: 192.168.1.2 (192.168.1.2)
Transmission Control Protocol, Src Port: 45393 (45393), Dst Port: 7910 (7910), Seq: 1, Ack: 1, Len: 0
    Source port: 45393 (45393)
    Destination port: 7910 (7910)
    [Stream index: 0]
    Sequence number: 1    (relative sequence number)
    Acknowledgement number: 1    (relative ack number)
    Header length: 32 bytes
    Flags: 0x10 (ACK)
    Window size: 5888 (scaled)
    Checksum: 0x837c [validation disabled]
    Options: (12 bytes)
        NOP
        NOP
        Timestamps: TSval 4242754, TSecr 4626387
    [SEQ/ACK analysis]

No.     Time        Source                Destination           Protocol Info
      4 0.404459    192.168.1.3           192.168.1.2           TCP      45393 > 7910 [PSH, ACK] Seq=1 Ack=1 Win=5888 Len=28 TSV=4242875 TSER=4626387

Frame 4: 94 bytes on wire (752 bits), 94 bytes captured (752 bits)
Ethernet II, Src: Usi_14:7f:23 (e0:2a:82:14:7f:23), Dst: Elitegro_f8:d7:51 (00:19:21:f8:d7:51)
Internet Protocol, Src: 192.168.1.3 (192.168.1.3), Dst: 192.168.1.2 (192.168.1.2)
Transmission Control Protocol, Src Port: 45393 (45393), Dst Port: 7910 (7910), Seq: 1, Ack: 1, Len: 28
    Source port: 45393 (45393)
    Destination port: 7910 (7910)
    [Stream index: 0]
    Sequence number: 1    (relative sequence number)
    [Next sequence number: 29    (relative sequence number)]
    Acknowledgement number: 1    (relative ack number)
    Header length: 32 bytes
    Flags: 0x18 (PSH, ACK)
    Window size: 5888 (scaled)
    Checksum: 0x1f68 [validation disabled]
    Options: (12 bytes)
        NOP
        NOP
        Timestamps: TSval 4242875, TSecr 4626387
    [SEQ/ACK analysis]
Data (28 bytes)

0000  18 00 00 00 01 00 00 00 6e 61 6d 65 6c 65 73 73   ........nameless
0010  00 00 00 00 00 00 00 00 5b b8 32 01               ........[.2.
    Data: 18000000010000006e616d656c6573730000000000000000...
    [Length: 28]

No.     Time        Source                Destination           Protocol Info
      5 0.409084    192.168.1.2           192.168.1.3           TCP      7910 > 45393 [ACK] Seq=1 Ack=29 Win=5888 Len=0 TSV=4626488 TSER=4242875

Frame 5: 66 bytes on wire (528 bits), 66 bytes captured (528 bits)
Ethernet II, Src: Elitegro_f8:d7:51 (00:19:21:f8:d7:51), Dst: Usi_14:7f:23 (e0:2a:82:14:7f:23)
Internet Protocol, Src: 192.168.1.2 (192.168.1.2), Dst: 192.168.1.3 (192.168.1.3)
Transmission Control Protocol, Src Port: 7910 (7910), Dst Port: 45393 (45393), Seq: 1, Ack: 29, Len: 0
    Source port: 7910 (7910)
    Destination port: 45393 (45393)
    [Stream index: 0]
    Sequence number: 1    (relative sequence number)
    Acknowledgement number: 29    (relative ack number)
    Header length: 32 bytes
    Flags: 0x10 (ACK)
    Window size: 5888 (scaled)
    Checksum: 0x8164 [validation disabled]
    Options: (12 bytes)
        NOP
        NOP
        Timestamps: TSval 4626488, TSecr 4242875
    [SEQ/ACK analysis]

No.     Time        Source                Destination           Protocol Info
      6 0.439385    192.168.1.2           192.168.1.3           TCP      7910 > 45393 [PSH, ACK] Seq=1 Ack=29 Win=5888 Len=517 TSV=4626496 TSER=4242875

Frame 6: 583 bytes on wire (4664 bits), 583 bytes captured (4664 bits)
Ethernet II, Src: Elitegro_f8:d7:51 (00:19:21:f8:d7:51), Dst: Usi_14:7f:23 (e0:2a:82:14:7f:23)
Internet Protocol, Src: 192.168.1.2 (192.168.1.2), Dst: 192.168.1.3 (192.168.1.3)
Transmission Control Protocol, Src Port: 7910 (7910), Dst Port: 45393 (45393), Seq: 1, Ack: 29, Len: 517
    Source port: 7910 (7910)
    Destination port: 45393 (45393)
    [Stream index: 0]
    Sequence number: 1    (relative sequence number)
    [Next sequence number: 518    (relative sequence number)]
    Acknowledgement number: 29    (relative ack number)
    Header length: 32 bytes
    Flags: 0x18 (PSH, ACK)
    Window size: 5888 (scaled)
    Checksum: 0x7e60 [validation disabled]
    Options: (12 bytes)
        NOP
        NOP
        Timestamps: TSval 4626496, TSecr 4242875
    [SEQ/ACK analysis]
Data (517 bytes)

0000  08 00 00 00 1d 00 00 00 5b b8 32 01 08 00 00 00   ........[.2.....
0010  1f 00 00 00 00 00 00 00 08 00 00 00 27 00 00 00   ............'...
0020  01 00 00 00 08 00 00 00 29 00 00 00 a0 0f 00 00   ........).......
0030  1a 00 00 00 2b 00 00 00 00 00 00 00 52 41 44 41   ....+.......RADA
0040  52 41 4c 54 49 20 33 30 34 2e 35 30 6d 00 40 00   RALTI 304.50m.@.
0050  00 00 04 00 00 00 41 54 53 55 47 49 5f 41 49 52   ......ATSUGI_AIR
0060  42 41 53 45 00 00 00 00 00 00 20 8d 42 b7 00 00   BASE...... .B...
0070  00 00 00 00 00 00 00 00 00 00 00 00 00 00 00 00   ................
0080  00 00 00 00 00 00 00 00 00 00 00 00 00 00 00 00   ................
0090  00 00 6f 01 00 00 2c 00 00 00 01 20 00 00 41 2d   ..o...,.... ..A-
00a0  34 5f 53 4b 59 48 41 57 4b 00 41 2d 36 5f 49 4e   4_SKYHAWK.A-6_IN
00b0  54 52 55 44 45 52 00 41 36 4d 35 5f 5a 45 52 4f   TRUDER.A6M5_ZERO
00c0  00 41 2d 31 30 41 5f 54 48 55 4e 44 45 52 42 4f   .A-10A_THUNDERBO
00d0  4c 54 32 00 41 48 2d 31 5f 43 4f 42 52 41 00 41   LT2.AH-1_COBRA.A
00e0  48 2d 36 34 5f 41 50 41 43 48 45 00 41 49 52 42   H-64_APACHE.AIRB
00f0  55 53 33 30 30 00 41 49 52 42 55 53 33 32 30 00   US300.AIRBUS320.
0100  41 4c 50 48 41 4a 45 54 00 41 4d 58 00 41 56 2d   ALPHAJET.AMX.AV-
0110  38 42 5f 48 41 52 52 49 45 52 00 42 2d 32 5f 53   8B_HARRIER.B-2_S
0120  50 49 52 49 54 00 42 2d 32 39 5f 53 55 50 45 52   PIRIT.B-29_SUPER
0130  46 4f 52 54 52 45 53 53 00 42 2d 35 32 5f 53 54   FORTRESS.B-52_ST
0140  52 41 54 4f 46 4f 52 54 52 45 53 53 00 42 37 33   RATOFORTRESS.B73
0150  37 00 42 37 34 37 00 42 37 36 37 00 42 37 37 37   7.B747.B767.B777
0160  00 43 2d 31 33 30 5f 48 45 52 43 55 4c 45 53 00   .C-130_HERCULES.
0170  43 4f 4e 43 4f 52 44 45 00 44 52 41 4b 45 4e 00   CONCORDE.DRAKEN.
0180  45 41 2d 36 42 5f 50 52 4f 57 4c 45 52 00 44 49   EA-6B_PROWLER.DI
0190  41 4d 4f 4e 44 5f 45 43 4c 49 50 53 45 00 45 55   AMOND_ECLIPSE.EU
01a0  52 4f 46 49 47 48 54 45 52 5f 54 59 50 48 4f 4f   ROFIGHTER_TYPHOO
01b0  4e 00 45 2d 32 43 5f 48 41 57 4b 45 59 45 00 46   N.E-2C_HAWKEYE.F
01c0  2d 31 00 46 2d 32 00 46 2d 34 45 4a 5f 50 48 41   -1.F-2.F-4EJ_PHA
01d0  4e 54 4f 4d 00 46 2d 34 45 5f 50 48 41 4e 54 4f   NTOM.F-4E_PHANTO
01e0  4d 00 46 2d 35 5f 54 49 47 45 52 32 00 46 2d 31   M.F-5_TIGER2.F-1
01f0  34 5f 54 4f 4d 43 41 54 00 46 2d 31 35 43 5f 45   4_TOMCAT.F-15C_E
0200  41 47 4c 45 00                                    AGLE.
    Data: 080000001d0000005bb83201080000001f00000000000000...
    [Length: 517]

No.     Time        Source                Destination           Protocol Info
      7 0.439412    192.168.1.3           192.168.1.2           TCP      45393 > 7910 [ACK] Seq=29 Ack=518 Win=6912 Len=0 TSV=4242885 TSER=4626496

Frame 7: 66 bytes on wire (528 bits), 66 bytes captured (528 bits)
Ethernet II, Src: Usi_14:7f:23 (e0:2a:82:14:7f:23), Dst: Elitegro_f8:d7:51 (00:19:21:f8:d7:51)
Internet Protocol, Src: 192.168.1.3 (192.168.1.3), Dst: 192.168.1.2 (192.168.1.2)
Transmission Control Protocol, Src Port: 45393 (45393), Dst Port: 7910 (7910), Seq: 29, Ack: 518, Len: 0
    Source port: 45393 (45393)
    Destination port: 7910 (7910)
    [Stream index: 0]
    Sequence number: 29    (relative sequence number)
    Acknowledgement number: 518    (relative ack number)
    Header length: 32 bytes
    Flags: 0x10 (ACK)
    Window size: 6912 (scaled)
    Checksum: 0x837c [validation disabled]
    Options: (12 bytes)
        NOP
        NOP
        Timestamps: TSval 4242885, TSecr 4626496
    [SEQ/ACK analysis]

No.     Time        Source                Destination           Protocol Info
      8 0.455895    192.168.1.3           192.168.1.2           TCP      45393 > 7910 [PSH, ACK] Seq=29 Ack=518 Win=6912 Len=525 TSV=4242890 TSER=4626496

Frame 8: 591 bytes on wire (4728 bits), 591 bytes captured (4728 bits)
Ethernet II, Src: Usi_14:7f:23 (e0:2a:82:14:7f:23), Dst: Elitegro_f8:d7:51 (00:19:21:f8:d7:51)
Internet Protocol, Src: 192.168.1.3 (192.168.1.3), Dst: 192.168.1.2 (192.168.1.2)
Transmission Control Protocol, Src Port: 45393 (45393), Dst Port: 7910 (7910), Seq: 29, Ack: 518, Len: 525
    Source port: 45393 (45393)
    Destination port: 7910 (7910)
    [Stream index: 0]
    Sequence number: 29    (relative sequence number)
    [Next sequence number: 554    (relative sequence number)]
    Acknowledgement number: 518    (relative ack number)
    Header length: 32 bytes
    Flags: 0x18 (PSH, ACK)
    Window size: 6912 (scaled)
    Checksum: 0xde05 [validation disabled]
    Options: (12 bytes)
        NOP
        NOP
        Timestamps: TSval 4242890, TSecr 4626496
    [SEQ/ACK analysis]
Data (525 bytes)

0000  0c 00 00 00 06 00 00 00 09 00 00 00 00 00 00 00   ................
0010  0c 00 00 00 06 00 00 00 0a 00 00 00 00 00 00 00   ................
0020  0c 00 00 00 06 00 00 00 0b 00 00 00 00 00 00 00   ................
0030  1a 00 00 00 2b 00 00 00 00 00 00 00 52 41 44 41   ....+.......RADA
0040  52 41 4c 54 49 20 33 30 34 2e 35 30 6d 00 40 00   RALTI 304.50m.@.
0050  00 00 04 00 00 00 41 54 53 55 47 49 5f 41 49 52   ......ATSUGI_AIR
0060  42 41 53 45 00 00 00 00 00 00 20 8d 42 b7 00 00   BASE...... .B...
0070  00 00 00 00 00 00 00 00 00 00 00 00 00 00 00 00   ................
0080  00 00 00 00 00 00 00 00 00 00 00 00 00 00 00 00   ................
0090  00 00 04 00 00 00 21 00 00 00 6f 01 00 00 2c 00   ......!...o...,.
00a0  00 00 01 20 00 00 41 2d 34 5f 53 4b 59 48 41 57   ... ..A-4_SKYHAW
00b0  4b 00 41 2d 36 5f 49 4e 54 52 55 44 45 52 00 41   K.A-6_INTRUDER.A
00c0  36 4d 35 5f 5a 45 52 4f 00 41 2d 31 30 41 5f 54   6M5_ZERO.A-10A_T
00d0  48 55 4e 44 45 52 42 4f 4c 54 32 00 41 48 2d 31   HUNDERBOLT2.AH-1
00e0  5f 43 4f 42 52 41 00 41 48 2d 36 34 5f 41 50 41   _COBRA.AH-64_APA
00f0  43 48 45 00 41 49 52 42 55 53 33 30 30 00 41 49   CHE.AIRBUS300.AI
0100  52 42 55 53 33 32 30 00 41 4c 50 48 41 4a 45 54   RBUS320.ALPHAJET
0110  00 41 4d 58 00 41 56 2d 38 42 5f 48 41 52 52 49   .AMX.AV-8B_HARRI
0120  45 52 00 42 2d 32 5f 53 50 49 52 49 54 00 42 2d   ER.B-2_SPIRIT.B-
0130  32 39 5f 53 55 50 45 52 46 4f 52 54 52 45 53 53   29_SUPERFORTRESS
0140  00 42 2d 35 32 5f 53 54 52 41 54 4f 46 4f 52 54   .B-52_STRATOFORT
0150  52 45 53 53 00 42 37 33 37 00 42 37 34 37 00 42   RESS.B737.B747.B
0160  37 36 37 00 42 37 37 37 00 43 2d 31 33 30 5f 48   767.B777.C-130_H
0170  45 52 43 55 4c 45 53 00 43 4f 4e 43 4f 52 44 45   ERCULES.CONCORDE
0180  00 44 52 41 4b 45 4e 00 45 41 2d 36 42 5f 50 52   .DRAKEN.EA-6B_PR
0190  4f 57 4c 45 52 00 44 49 41 4d 4f 4e 44 5f 45 43   OWLER.DIAMOND_EC
01a0  4c 49 50 53 45 00 45 55 52 4f 46 49 47 48 54 45   LIPSE.EUROFIGHTE
01b0  52 5f 54 59 50 48 4f 4f 4e 00 45 2d 32 43 5f 48   R_TYPHOON.E-2C_H
01c0  41 57 4b 45 59 45 00 46 2d 31 00 46 2d 32 00 46   AWKEYE.F-1.F-2.F
01d0  2d 34 45 4a 5f 50 48 41 4e 54 4f 4d 00 46 2d 34   -4EJ_PHANTOM.F-4
01e0  45 5f 50 48 41 4e 54 4f 4d 00 46 2d 35 5f 54 49   E_PHANTOM.F-5_TI
01f0  47 45 52 32 00 46 2d 31 34 5f 54 4f 4d 43 41 54   GER2.F-14_TOMCAT
0200  00 46 2d 31 35 43 5f 45 41 47 4c 45 00            .F-15C_EAGLE.
    Data: 0c0000000600000009000000000000000c00000006000000...
    [Length: 525]

No.     Time        Source                Destination           Protocol Info
      9 0.472382    192.168.1.2           192.168.1.3           TCP      7910 > 45393 [PSH, ACK] Seq=518 Ack=554 Win=6912 Len=32 TSV=4626505 TSER=4242890

Frame 9: 98 bytes on wire (784 bits), 98 bytes captured (784 bits)
Ethernet II, Src: Elitegro_f8:d7:51 (00:19:21:f8:d7:51), Dst: Usi_14:7f:23 (e0:2a:82:14:7f:23)
Internet Protocol, Src: 192.168.1.2 (192.168.1.2), Dst: 192.168.1.3 (192.168.1.3)
Transmission Control Protocol, Src Port: 7910 (7910), Dst Port: 45393 (45393), Seq: 518, Ack: 554, Len: 32
    Source port: 7910 (7910)
    Destination port: 45393 (45393)
    [Stream index: 0]
    Sequence number: 518    (relative sequence number)
    [Next sequence number: 550    (relative sequence number)]
    Acknowledgement number: 554    (relative ack number)
    Header length: 32 bytes
    Flags: 0x18 (PSH, ACK)
    Window size: 6912 (scaled)
    Checksum: 0x2ebb [validation disabled]
    Options: (12 bytes)
        NOP
        NOP
        Timestamps: TSval 4626505, TSecr 4242890
    [SEQ/ACK analysis]
Data (32 bytes)

0000  1c 00 00 00 21 00 00 00 01 00 00 00 e1 00 00 00   ....!...........
0010  00 00 00 00 00 00 00 00 00 00 00 00 00 00 2f 46   ............../F
    Data: 1c0000002100000001000000e10000000000000000000000...
    [Length: 32]

No.     Time        Source                Destination           Protocol Info
     10 0.519474    192.168.1.3           192.168.1.2           TCP      45393 > 7910 [ACK] Seq=554 Ack=550 Win=6912 Len=0 TSV=4242910 TSER=4626505

Frame 10: 66 bytes on wire (528 bits), 66 bytes captured (528 bits)
Ethernet II, Src: Usi_14:7f:23 (e0:2a:82:14:7f:23), Dst: Elitegro_f8:d7:51 (00:19:21:f8:d7:51)
Internet Protocol, Src: 192.168.1.3 (192.168.1.3), Dst: 192.168.1.2 (192.168.1.2)
Transmission Control Protocol, Src Port: 45393 (45393), Dst Port: 7910 (7910), Seq: 554, Ack: 550, Len: 0
    Source port: 45393 (45393)
    Destination port: 7910 (7910)
    [Stream index: 0]
    Sequence number: 554    (relative sequence number)
    Acknowledgement number: 550    (relative ack number)
    Header length: 32 bytes
    Flags: 0x10 (ACK)
    Window size: 6912 (scaled)
    Checksum: 0x837c [validation disabled]
    Options: (12 bytes)
        NOP
        NOP
        Timestamps: TSval 4242910, TSecr 4626505
    [SEQ/ACK analysis]

No.     Time        Source                Destination           Protocol Info
     11 0.742114    192.168.1.3           192.168.1.2           TCP      45393 > 7910 [PSH, ACK] Seq=554 Ack=550 Win=6912 Len=16 TSV=4242976 TSER=4626505

Frame 11: 82 bytes on wire (656 bits), 82 bytes captured (656 bits)
Ethernet II, Src: Usi_14:7f:23 (e0:2a:82:14:7f:23), Dst: Elitegro_f8:d7:51 (00:19:21:f8:d7:51)
Internet Protocol, Src: 192.168.1.3 (192.168.1.3), Dst: 192.168.1.2 (192.168.1.2)
Transmission Control Protocol, Src Port: 45393 (45393), Dst Port: 7910 (7910), Seq: 554, Ack: 550, Len: 16
    Source port: 45393 (45393)
    Destination port: 7910 (7910)
    [Stream index: 0]
    Sequence number: 554    (relative sequence number)
    [Next sequence number: 570    (relative sequence number)]
    Acknowledgement number: 550    (relative ack number)
    Header length: 32 bytes
    Flags: 0x18 (PSH, ACK)
    Window size: 6912 (scaled)
    Checksum: 0x669c [validation disabled]
    Options: (12 bytes)
        NOP
        NOP
        Timestamps: TSval 4242976, TSecr 4626505
    [SEQ/ACK analysis]
Data (16 bytes)

0000  0c 00 00 00 06 00 00 00 04 00 00 00 00 00 00 00   ................
    Data: 0c000000060000000400000000000000
    [Length: 16]

No.     Time        Source                Destination           Protocol Info
     12 0.785784    192.168.1.2           192.168.1.3           TCP      7910 > 45393 [ACK] Seq=550 Ack=570 Win=6912 Len=0 TSV=4626583 TSER=4242976

Frame 12: 66 bytes on wire (528 bits), 66 bytes captured (528 bits)
Ethernet II, Src: Elitegro_f8:d7:51 (00:19:21:f8:d7:51), Dst: Usi_14:7f:23 (e0:2a:82:14:7f:23)
Internet Protocol, Src: 192.168.1.2 (192.168.1.2), Dst: 192.168.1.3 (192.168.1.3)
Transmission Control Protocol, Src Port: 7910 (7910), Dst Port: 45393 (45393), Seq: 550, Ack: 570, Len: 0
    Source port: 7910 (7910)
    Destination port: 45393 (45393)
    [Stream index: 0]
    Sequence number: 550    (relative sequence number)
    Acknowledgement number: 570    (relative ack number)
    Header length: 32 bytes
    Flags: 0x10 (ACK)
    Window size: 6912 (scaled)
    Checksum: 0x7c56 [validation disabled]
    Options: (12 bytes)
        NOP
        NOP
        Timestamps: TSval 4626583, TSecr 4242976
    [SEQ/ACK analysis]

No.     Time        Source                Destination           Protocol Info
     13 0.980381    192.168.1.2           192.168.1.3           TCP      7910 > 45393 [PSH, ACK] Seq=550 Ack=570 Win=6912 Len=495 TSV=4626631 TSER=4242976

Frame 13: 561 bytes on wire (4488 bits), 561 bytes captured (4488 bits)
Ethernet II, Src: Elitegro_f8:d7:51 (00:19:21:f8:d7:51), Dst: Usi_14:7f:23 (e0:2a:82:14:7f:23)
Internet Protocol, Src: 192.168.1.2 (192.168.1.2), Dst: 192.168.1.3 (192.168.1.3)
Transmission Control Protocol, Src Port: 7910 (7910), Dst Port: 45393 (45393), Seq: 550, Ack: 570, Len: 495
    Source port: 7910 (7910)
    Destination port: 45393 (45393)
    [Stream index: 0]
    Sequence number: 550    (relative sequence number)
    [Next sequence number: 1045    (relative sequence number)]
    Acknowledgement number: 570    (relative ack number)
    Header length: 32 bytes
    Flags: 0x18 (PSH, ACK)
    Window size: 6912 (scaled)
    Checksum: 0xc8d0 [validation disabled]
    Options: (12 bytes)
        NOP
        NOP
        Timestamps: TSval 4626631, TSecr 4242976
    [SEQ/ACK analysis]
Data (495 bytes)

0000  eb 01 00 00 2c 00 00 00 01 20 00 00 46 2d 31 35   ....,.... ..F-15
0010  44 5f 45 41 47 4c 45 00 46 2d 31 35 44 4a 5f 45   D_EAGLE.F-15DJ_E
0020  41 47 4c 45 00 46 2d 31 35 44 4a 5f 45 41 47 4c   AGLE.F-15DJ_EAGL
0030  45 5f 4d 41 44 41 52 41 00 46 2d 31 35 44 4a 5f   E_MADARA.F-15DJ_
0040  45 41 47 4c 45 5f 43 48 41 49 52 4f 00 46 2d 31   EAGLE_CHAIRO.F-1
0050  35 44 4a 5f 45 41 47 4c 45 5f 4b 55 52 4f 00 46   5DJ_EAGLE_KURO.F
0060  2d 31 35 44 4a 5f 45 41 47 4c 45 5f 4d 49 44 4f   -15DJ_EAGLE_MIDO
0070  52 49 00 46 2d 31 35 44 4a 5f 45 41 47 4c 45 5f   RI.F-15DJ_EAGLE_
0080  4e 41 4b 41 41 4f 00 46 2d 31 35 44 4a 5f 45 41   NAKAAO.F-15DJ_EA
0090  47 4c 45 5f 53 4f 54 4f 41 4f 00 46 2d 31 35 44   GLE_SOTOAO.F-15D
00a0  4a 5f 45 41 47 4c 45 5f 53 4f 54 4f 4d 49 44 4f   J_EAGLE_SOTOMIDO
00b0  52 49 00 46 2d 31 35 4a 5f 45 41 47 4c 45 00 46   RI.F-15J_EAGLE.F
00c0  2d 31 36 43 5f 46 49 47 48 54 49 4e 47 46 41 4c   -16C_FIGHTINGFAL
00d0  43 4f 4e 00 46 2d 31 36 43 5f 54 48 55 4e 44 45   CON.F-16C_THUNDE
00e0  52 42 49 52 44 53 00 46 2d 31 38 43 5f 48 4f 52   RBIRDS.F-18C_HOR
00f0  4e 45 54 00 46 2d 31 38 45 5f 53 55 50 45 52 48   NET.F-18E_SUPERH
0100  4f 52 4e 45 54 00 46 2d 31 38 43 5f 42 4c 55 45   ORNET.F-18C_BLUE
0110  41 4e 47 45 4c 53 00 46 2d 32 32 5f 52 41 50 54   ANGELS.F-22_RAPT
0120  4f 52 00 46 2d 38 36 5f 42 4c 55 45 49 4d 50 55   OR.F-86_BLUEIMPU
0130  4c 53 45 00 46 2d 31 30 30 44 5f 53 55 50 45 52   LSE.F-100D_SUPER
0140  53 41 42 52 45 00 46 2d 31 30 34 5f 53 54 41 52   SABRE.F-104_STAR
0150  46 49 47 48 54 45 52 00 46 2d 31 31 37 41 5f 4e   FIGHTER.F-117A_N
0160  49 47 48 54 48 41 57 4b 00 46 4f 43 4b 45 5f 57   IGHTHAWK.FOCKE_W
0170  55 4c 46 5f 46 57 31 39 30 00 47 52 49 50 45 4e   ULF_FW190.GRIPEN
0180  00 47 34 4d 5f 54 59 50 45 31 42 4f 4d 42 45 52   .G4M_TYPE1BOMBER
0190  00 48 41 57 4b 00 48 55 52 52 49 43 41 4e 45 00   .HAWK.HURRICANE.
01a0  48 41 57 4b 5f 52 45 44 41 52 52 4f 57 53 00 4b   HAWK_REDARROWS.K
01b0  46 49 52 00 4c 41 4e 43 41 53 54 45 52 00 4d 55   FIR.LANCASTER.MU
01c0  2d 32 53 00 4d 49 47 2d 31 35 5f 46 41 47 4f 54   -2S.MIG-15_FAGOT
01d0  00 4d 49 47 2d 32 31 5f 46 49 53 48 42 45 44 00   .MIG-21_FISHBED.
01e0  4d 49 47 2d 32 33 5f 46 4c 4f 47 47 45 52 00      MIG-23_FLOGGER.
    Data: eb0100002c00000001200000462d3135445f4541474c4500...
    [Length: 495]

No.     Time        Source                Destination           Protocol Info
     14 0.980414    192.168.1.3           192.168.1.2           TCP      45393 > 7910 [ACK] Seq=570 Ack=1045 Win=8064 Len=0 TSV=4243048 TSER=4626631

Frame 14: 66 bytes on wire (528 bits), 66 bytes captured (528 bits)
Ethernet II, Src: Usi_14:7f:23 (e0:2a:82:14:7f:23), Dst: Elitegro_f8:d7:51 (00:19:21:f8:d7:51)
Internet Protocol, Src: 192.168.1.3 (192.168.1.3), Dst: 192.168.1.2 (192.168.1.2)
Transmission Control Protocol, Src Port: 45393 (45393), Dst Port: 7910 (7910), Seq: 570, Ack: 1045, Len: 0
    Source port: 45393 (45393)
    Destination port: 7910 (7910)
    [Stream index: 0]
    Sequence number: 570    (relative sequence number)
    Acknowledgement number: 1045    (relative ack number)
    Header length: 32 bytes
    Flags: 0x10 (ACK)
    Window size: 8064 (scaled)
    Checksum: 0x837c [validation disabled]
    Options: (12 bytes)
        NOP
        NOP
        Timestamps: TSval 4243048, TSecr 4626631
    [SEQ/ACK analysis]

No.     Time        Source                Destination           Protocol Info
     15 1.001287    192.168.1.3           192.168.1.2           TCP      45393 > 7910 [PSH, ACK] Seq=570 Ack=1045 Win=8064 Len=495 TSV=4243054 TSER=4626631

Frame 15: 561 bytes on wire (4488 bits), 561 bytes captured (4488 bits)
Ethernet II, Src: Usi_14:7f:23 (e0:2a:82:14:7f:23), Dst: Elitegro_f8:d7:51 (00:19:21:f8:d7:51)
Internet Protocol, Src: 192.168.1.3 (192.168.1.3), Dst: 192.168.1.2 (192.168.1.2)
Transmission Control Protocol, Src Port: 45393 (45393), Dst Port: 7910 (7910), Seq: 570, Ack: 1045, Len: 495
    Source port: 45393 (45393)
    Destination port: 7910 (7910)
    [Stream index: 0]
    Sequence number: 570    (relative sequence number)
    [Next sequence number: 1065    (relative sequence number)]
    Acknowledgement number: 1045    (relative ack number)
    Header length: 32 bytes
    Flags: 0x18 (PSH, ACK)
    Window size: 8064 (scaled)
    Checksum: 0xc68a [validation disabled]
    Options: (12 bytes)
        NOP
        NOP
        Timestamps: TSval 4243054, TSecr 4626631
    [SEQ/ACK analysis]
Data (495 bytes)

0000  eb 01 00 00 2c 00 00 00 01 20 00 00 46 2d 31 35   ....,.... ..F-15
0010  44 5f 45 41 47 4c 45 00 46 2d 31 35 44 4a 5f 45   D_EAGLE.F-15DJ_E
0020  41 47 4c 45 00 46 2d 31 35 44 4a 5f 45 41 47 4c   AGLE.F-15DJ_EAGL
0030  45 5f 4d 41 44 41 52 41 00 46 2d 31 35 44 4a 5f   E_MADARA.F-15DJ_
0040  45 41 47 4c 45 5f 43 48 41 49 52 4f 00 46 2d 31   EAGLE_CHAIRO.F-1
0050  35 44 4a 5f 45 41 47 4c 45 5f 4b 55 52 4f 00 46   5DJ_EAGLE_KURO.F
0060  2d 31 35 44 4a 5f 45 41 47 4c 45 5f 4d 49 44 4f   -15DJ_EAGLE_MIDO
0070  52 49 00 46 2d 31 35 44 4a 5f 45 41 47 4c 45 5f   RI.F-15DJ_EAGLE_
0080  4e 41 4b 41 41 4f 00 46 2d 31 35 44 4a 5f 45 41   NAKAAO.F-15DJ_EA
0090  47 4c 45 5f 53 4f 54 4f 41 4f 00 46 2d 31 35 44   GLE_SOTOAO.F-15D
00a0  4a 5f 45 41 47 4c 45 5f 53 4f 54 4f 4d 49 44 4f   J_EAGLE_SOTOMIDO
00b0  52 49 00 46 2d 31 35 4a 5f 45 41 47 4c 45 00 46   RI.F-15J_EAGLE.F
00c0  2d 31 36 43 5f 46 49 47 48 54 49 4e 47 46 41 4c   -16C_FIGHTINGFAL
00d0  43 4f 4e 00 46 2d 31 36 43 5f 54 48 55 4e 44 45   CON.F-16C_THUNDE
00e0  52 42 49 52 44 53 00 46 2d 31 38 43 5f 48 4f 52   RBIRDS.F-18C_HOR
00f0  4e 45 54 00 46 2d 31 38 45 5f 53 55 50 45 52 48   NET.F-18E_SUPERH
0100  4f 52 4e 45 54 00 46 2d 31 38 43 5f 42 4c 55 45   ORNET.F-18C_BLUE
0110  41 4e 47 45 4c 53 00 46 2d 32 32 5f 52 41 50 54   ANGELS.F-22_RAPT
0120  4f 52 00 46 2d 38 36 5f 42 4c 55 45 49 4d 50 55   OR.F-86_BLUEIMPU
0130  4c 53 45 00 46 2d 31 30 30 44 5f 53 55 50 45 52   LSE.F-100D_SUPER
0140  53 41 42 52 45 00 46 2d 31 30 34 5f 53 54 41 52   SABRE.F-104_STAR
0150  46 49 47 48 54 45 52 00 46 2d 31 31 37 41 5f 4e   FIGHTER.F-117A_N
0160  49 47 48 54 48 41 57 4b 00 46 4f 43 4b 45 5f 57   IGHTHAWK.FOCKE_W
0170  55 4c 46 5f 46 57 31 39 30 00 47 52 49 50 45 4e   ULF_FW190.GRIPEN
0180  00 47 34 4d 5f 54 59 50 45 31 42 4f 4d 42 45 52   .G4M_TYPE1BOMBER
0190  00 48 41 57 4b 00 48 55 52 52 49 43 41 4e 45 00   .HAWK.HURRICANE.
01a0  48 41 57 4b 5f 52 45 44 41 52 52 4f 57 53 00 4b   HAWK_REDARROWS.K
01b0  46 49 52 00 4c 41 4e 43 41 53 54 45 52 00 4d 55   FIR.LANCASTER.MU
01c0  2d 32 53 00 4d 49 47 2d 31 35 5f 46 41 47 4f 54   -2S.MIG-15_FAGOT
01d0  00 4d 49 47 2d 32 31 5f 46 49 53 48 42 45 44 00   .MIG-21_FISHBED.
01e0  4d 49 47 2d 32 33 5f 46 4c 4f 47 47 45 52 00      MIG-23_FLOGGER.
    Data: eb0100002c00000001200000462d3135445f4541474c4500...
    [Length: 495]

No.     Time        Source                Destination           Protocol Info
     16 1.005765    192.168.1.2           192.168.1.3           TCP      7910 > 45393 [ACK] Seq=1045 Ack=1065 Win=7936 Len=0 TSV=4626638 TSER=4243054

Frame 16: 66 bytes on wire (528 bits), 66 bytes captured (528 bits)
Ethernet II, Src: Elitegro_f8:d7:51 (00:19:21:f8:d7:51), Dst: Usi_14:7f:23 (e0:2a:82:14:7f:23)
Internet Protocol, Src: 192.168.1.2 (192.168.1.2), Dst: 192.168.1.3 (192.168.1.3)
Transmission Control Protocol, Src Port: 7910 (7910), Dst Port: 45393 (45393), Seq: 1045, Ack: 1065, Len: 0
    Source port: 7910 (7910)
    Destination port: 45393 (45393)
    [Stream index: 0]
    Sequence number: 1045    (relative sequence number)
    Acknowledgement number: 1065    (relative ack number)
    Header length: 32 bytes
    Flags: 0x10 (ACK)
    Window size: 7936 (scaled)
    Checksum: 0x77eb [validation disabled]
    Options: (12 bytes)
        NOP
        NOP
        Timestamps: TSval 4626638, TSecr 4243054
    [SEQ/ACK analysis]

No.     Time        Source                Destination           Protocol Info
     17 1.484895    192.168.1.2           192.168.1.3           TCP      7910 > 45393 [PSH, ACK] Seq=1045 Ack=1065 Win=7936 Len=294 TSV=4626757 TSER=4243054

Frame 17: 360 bytes on wire (2880 bits), 360 bytes captured (2880 bits)
Ethernet II, Src: Elitegro_f8:d7:51 (00:19:21:f8:d7:51), Dst: Usi_14:7f:23 (e0:2a:82:14:7f:23)
Internet Protocol, Src: 192.168.1.2 (192.168.1.2), Dst: 192.168.1.3 (192.168.1.3)
Transmission Control Protocol, Src Port: 7910 (7910), Dst Port: 45393 (45393), Seq: 1045, Ack: 1065, Len: 294
    Source port: 7910 (7910)
    Destination port: 45393 (45393)
    [Stream index: 0]
    Sequence number: 1045    (relative sequence number)
    [Next sequence number: 1339    (relative sequence number)]
    Acknowledgement number: 1065    (relative ack number)
    Header length: 32 bytes
    Flags: 0x18 (PSH, ACK)
    Window size: 7936 (scaled)
    Checksum: 0x7c43 [validation disabled]
    Options: (12 bytes)
        NOP
        NOP
        Timestamps: TSval 4626757, TSecr 4243054
    [SEQ/ACK analysis]
Data (294 bytes)

0000  22 01 00 00 2c 00 00 00 01 17 00 00 4d 49 47 2d   "...,.......MIG-
0010  32 39 5f 46 55 4c 43 52 55 4d 00 4d 49 52 41 47   29_FULCRUM.MIRAG
0020  45 32 30 30 30 00 50 2d 35 31 5f 4d 55 53 54 41   E2000.P-51_MUSTA
0030  4e 47 00 50 49 50 45 52 5f 41 52 43 48 45 52 28   NG.PIPER_ARCHER(
0040  57 41 53 48 49 4e 2d 41 49 52 5f 4d 41 52 4b 49   WASHIN-AIR_MARKI
0050  4e 47 29 00 52 41 46 41 4c 45 00 53 2d 33 5f 56   NG).RAFALE.S-3_V
0060  49 4b 49 4e 47 00 53 50 49 54 46 49 52 45 00 53   IKING.SPITFIRE.S
0070  55 2d 32 32 5f 46 49 54 54 45 52 00 53 55 2d 32   U-22_FITTER.SU-2
0080  34 5f 46 45 4e 43 45 52 00 53 55 2d 32 35 5f 46   4_FENCER.SU-25_F
0090  52 4f 47 46 4f 4f 54 00 53 55 2d 32 37 5f 46 4c   ROGFOOT.SU-27_FL
00a0  41 4e 4b 45 52 00 54 2d 32 5f 42 4c 55 45 49 4d   ANKER.T-2_BLUEIM
00b0  50 55 4c 53 45 00 54 2d 34 5f 42 4c 55 45 49 4d   PULSE.T-4_BLUEIM
00c0  50 55 4c 53 45 00 54 2d 34 30 30 00 54 4f 52 4e   PULSE.T-400.TORN
00d0  41 44 4f 00 54 55 2d 31 36 30 5f 42 4c 41 43 4b   ADO.TU-160_BLACK
00e0  4a 41 43 4b 00 55 2d 31 32 35 00 55 2d 31 32 35   JACK.U-125.U-125
00f0  41 00 55 48 2d 36 30 5f 42 4c 41 43 4b 48 41 57   A.UH-60_BLACKHAW
0100  4b 00 55 48 2d 36 30 4a 5f 42 4c 41 43 4b 48 41   K.UH-60J_BLACKHA
0110  57 4b 00 56 2d 31 30 37 00 56 49 47 47 45 4e 00   WK.V-107.VIGGEN.
0120  59 53 2d 31 31 00                                 YS-11.
    Data: 220100002c000000011700004d49472d32395f46554c4352...
    [Length: 294]

No.     Time        Source                Destination           Protocol Info
     18 1.507275    192.168.1.3           192.168.1.2           TCP      45393 > 7910 [PSH, ACK] Seq=1065 Ack=1339 Win=9088 Len=294 TSV=4243206 TSER=4626757

Frame 18: 360 bytes on wire (2880 bits), 360 bytes captured (2880 bits)
Ethernet II, Src: Usi_14:7f:23 (e0:2a:82:14:7f:23), Dst: Elitegro_f8:d7:51 (00:19:21:f8:d7:51)
Internet Protocol, Src: 192.168.1.3 (192.168.1.3), Dst: 192.168.1.2 (192.168.1.2)
Transmission Control Protocol, Src Port: 45393 (45393), Dst Port: 7910 (7910), Seq: 1065, Ack: 1339, Len: 294
    Source port: 45393 (45393)
    Destination port: 7910 (7910)
    [Stream index: 0]
    Sequence number: 1065    (relative sequence number)
    [Next sequence number: 1359    (relative sequence number)]
    Acknowledgement number: 1339    (relative ack number)
    Header length: 32 bytes
    Flags: 0x18 (PSH, ACK)
    Window size: 9088 (scaled)
    Checksum: 0x7a7c [validation disabled]
    Options: (12 bytes)
        NOP
        NOP
        Timestamps: TSval 4243206, TSecr 4626757
    [SEQ/ACK analysis]
Data (294 bytes)

0000  22 01 00 00 2c 00 00 00 01 17 00 00 4d 49 47 2d   "...,.......MIG-
0010  32 39 5f 46 55 4c 43 52 55 4d 00 4d 49 52 41 47   29_FULCRUM.MIRAG
0020  45 32 30 30 30 00 50 2d 35 31 5f 4d 55 53 54 41   E2000.P-51_MUSTA
0030  4e 47 00 50 49 50 45 52 5f 41 52 43 48 45 52 28   NG.PIPER_ARCHER(
0040  57 41 53 48 49 4e 2d 41 49 52 5f 4d 41 52 4b 49   WASHIN-AIR_MARKI
0050  4e 47 29 00 52 41 46 41 4c 45 00 53 2d 33 5f 56   NG).RAFALE.S-3_V
0060  49 4b 49 4e 47 00 53 50 49 54 46 49 52 45 00 53   IKING.SPITFIRE.S
0070  55 2d 32 32 5f 46 49 54 54 45 52 00 53 55 2d 32   U-22_FITTER.SU-2
0080  34 5f 46 45 4e 43 45 52 00 53 55 2d 32 35 5f 46   4_FENCER.SU-25_F
0090  52 4f 47 46 4f 4f 54 00 53 55 2d 32 37 5f 46 4c   ROGFOOT.SU-27_FL
00a0  41 4e 4b 45 52 00 54 2d 32 5f 42 4c 55 45 49 4d   ANKER.T-2_BLUEIM
00b0  50 55 4c 53 45 00 54 2d 34 5f 42 4c 55 45 49 4d   PULSE.T-4_BLUEIM
00c0  50 55 4c 53 45 00 54 2d 34 30 30 00 54 4f 52 4e   PULSE.T-400.TORN
00d0  41 44 4f 00 54 55 2d 31 36 30 5f 42 4c 41 43 4b   ADO.TU-160_BLACK
00e0  4a 41 43 4b 00 55 2d 31 32 35 00 55 2d 31 32 35   JACK.U-125.U-125
00f0  41 00 55 48 2d 36 30 5f 42 4c 41 43 4b 48 41 57   A.UH-60_BLACKHAW
0100  4b 00 55 48 2d 36 30 4a 5f 42 4c 41 43 4b 48 41   K.UH-60J_BLACKHA
0110  57 4b 00 56 2d 31 30 37 00 56 49 47 47 45 4e 00   WK.V-107.VIGGEN.
0120  59 53 2d 31 31 00                                 YS-11.
    Data: 220100002c000000011700004d49472d32395f46554c4352...
    [Length: 294]

No.     Time        Source                Destination           Protocol Info
     19 1.510945    192.168.1.2           192.168.1.3           TCP      7910 > 45393 [ACK] Seq=1339 Ack=1359 Win=9088 Len=0 TSV=4626764 TSER=4243206

Frame 19: 66 bytes on wire (528 bits), 66 bytes captured (528 bits)
Ethernet II, Src: Elitegro_f8:d7:51 (00:19:21:f8:d7:51), Dst: Usi_14:7f:23 (e0:2a:82:14:7f:23)
Internet Protocol, Src: 192.168.1.2 (192.168.1.2), Dst: 192.168.1.3 (192.168.1.3)
Transmission Control Protocol, Src Port: 7910 (7910), Dst Port: 45393 (45393), Seq: 1339, Ack: 1359, Len: 0
    Source port: 7910 (7910)
    Destination port: 45393 (45393)
    [Stream index: 0]
    Sequence number: 1339    (relative sequence number)
    Acknowledgement number: 1359    (relative ack number)
    Header length: 32 bytes
    Flags: 0x10 (ACK)
    Window size: 9088 (scaled)
    Checksum: 0x7480 [validation disabled]
    Options: (12 bytes)
        NOP
        NOP
        Timestamps: TSval 4626764, TSecr 4243206
    [SEQ/ACK analysis]

No.     Time        Source                Destination           Protocol Info
     20 2.001050    192.168.1.2           192.168.1.3           TCP      7910 > 45393 [PSH, ACK] Seq=1339 Ack=1359 Win=9088 Len=8 TSV=4626886 TSER=4243206

Frame 20: 74 bytes on wire (592 bits), 74 bytes captured (592 bits)
Ethernet II, Src: Elitegro_f8:d7:51 (00:19:21:f8:d7:51), Dst: Usi_14:7f:23 (e0:2a:82:14:7f:23)
Internet Protocol, Src: 192.168.1.2 (192.168.1.2), Dst: 192.168.1.3 (192.168.1.3)
Transmission Control Protocol, Src Port: 7910 (7910), Dst Port: 45393 (45393), Seq: 1339, Ack: 1359, Len: 8
    Source port: 7910 (7910)
    Destination port: 45393 (45393)
    [Stream index: 0]
    Sequence number: 1339    (relative sequence number)
    [Next sequence number: 1347    (relative sequence number)]
    Acknowledgement number: 1359    (relative ack number)
    Header length: 32 bytes
    Flags: 0x18 (PSH, ACK)
    Window size: 9088 (scaled)
    Checksum: 0x5ff6 [validation disabled]
    Options: (12 bytes)
        NOP
        NOP
        Timestamps: TSval 4626886, TSecr 4243206
    [SEQ/ACK analysis]
Data (8 bytes)

0000  04 00 00 00 10 00 00 00                           ........
    Data: 0400000010000000
    [Length: 8]

No.     Time        Source                Destination           Protocol Info
     21 2.013551    192.168.1.3           192.168.1.2           TCP      45393 > 7910 [PSH, ACK] Seq=1359 Ack=1347 Win=9088 Len=16 TSV=4243358 TSER=4626886

Frame 21: 82 bytes on wire (656 bits), 82 bytes captured (656 bits)
Ethernet II, Src: Usi_14:7f:23 (e0:2a:82:14:7f:23), Dst: Elitegro_f8:d7:51 (00:19:21:f8:d7:51)
Internet Protocol, Src: 192.168.1.3 (192.168.1.3), Dst: 192.168.1.2 (192.168.1.2)
Transmission Control Protocol, Src Port: 45393 (45393), Dst Port: 7910 (7910), Seq: 1359, Ack: 1347, Len: 16
    Source port: 45393 (45393)
    Destination port: 7910 (7910)
    [Stream index: 0]
    Sequence number: 1359    (relative sequence number)
    [Next sequence number: 1375    (relative sequence number)]
    Acknowledgement number: 1347    (relative ack number)
    Header length: 32 bytes
    Flags: 0x18 (PSH, ACK)
    Window size: 9088 (scaled)
    Checksum: 0x5a4e [validation disabled]
    Options: (12 bytes)
        NOP
        NOP
        Timestamps: TSval 4243358, TSecr 4626886
    [SEQ/ACK analysis]
Data (16 bytes)

0000  0c 00 00 00 06 00 00 00 07 00 00 00 00 00 00 00   ................
    Data: 0c000000060000000700000000000000
    [Length: 16]

No.     Time        Source                Destination           Protocol Info
     22 2.020751    192.168.1.2           192.168.1.3           TCP      7910 > 45393 [ACK] Seq=1347 Ack=1375 Win=9088 Len=0 TSV=4626891 TSER=4243358

Frame 22: 66 bytes on wire (528 bits), 66 bytes captured (528 bits)
Ethernet II, Src: Elitegro_f8:d7:51 (00:19:21:f8:d7:51), Dst: Usi_14:7f:23 (e0:2a:82:14:7f:23)
Internet Protocol, Src: 192.168.1.2 (192.168.1.2), Dst: 192.168.1.3 (192.168.1.3)
Transmission Control Protocol, Src Port: 7910 (7910), Dst Port: 45393 (45393), Seq: 1347, Ack: 1375, Len: 0
    Source port: 7910 (7910)
    Destination port: 45393 (45393)
    [Stream index: 0]
    Sequence number: 1347    (relative sequence number)
    Acknowledgement number: 1375    (relative ack number)
    Header length: 32 bytes
    Flags: 0x10 (ACK)
    Window size: 9088 (scaled)
    Checksum: 0x7351 [validation disabled]
    Options: (12 bytes)
        NOP
        NOP
        Timestamps: TSval 4626891, TSecr 4243358
    [SEQ/ACK analysis]

No.     Time        Source                Destination           Protocol Info
     23 2.727659    192.168.1.2           192.168.1.3           TCP      7910 > 45393 [PSH, ACK] Seq=1347 Ack=1375 Win=9088 Len=300 TSV=4627068 TSER=4243358

Frame 23: 366 bytes on wire (2928 bits), 366 bytes captured (2928 bits)
Ethernet II, Src: Elitegro_f8:d7:51 (00:19:21:f8:d7:51), Dst: Usi_14:7f:23 (e0:2a:82:14:7f:23)
Internet Protocol, Src: 192.168.1.2 (192.168.1.2), Dst: 192.168.1.3 (192.168.1.3)
Transmission Control Protocol, Src Port: 7910 (7910), Dst Port: 45393 (45393), Seq: 1347, Ack: 1375, Len: 300
    Source port: 7910 (7910)
    Destination port: 45393 (45393)
    [Stream index: 0]
    Sequence number: 1347    (relative sequence number)
    [Next sequence number: 1647    (relative sequence number)]
    Acknowledgement number: 1375    (relative ack number)
    Header length: 32 bytes
    Flags: 0x18 (PSH, ACK)
    Window size: 9088 (scaled)
    Checksum: 0x5cb3 [validation disabled]
    Options: (12 bytes)
        NOP
        NOP
        Timestamps: TSval 4627068, TSecr 4243358
    [SEQ/ACK analysis]
Data (300 bytes)

0000  2c 00 00 00 20 00 00 00 00 00 00 00 00 00 00 00   ,... ...........
0010  2a 2a 20 4c 6f 67 2d 6f 6e 20 70 72 6f 63 65 73   ** Log-on proces
0020  73 20 63 6f 6d 70 6c 65 74 65 64 20 2a 2a 00 00   s completed **..
0030  f8 00 00 00 20 00 00 00 00 00 00 00 00 00 00 00   .... ...........
0040  2d 2d 2d 2d 2d 2d 2d 2d 2d 2d 2d 2d 2d 2d 2d 2d   ----------------
0050  2d 2d 2d 2d 2d 2d 2d 2d 2d 2d 2d 2d 2d 2d 2d 2d   ----------------
0060  2d 2d 2d 2d 2d 2d 2d 2d 2d 2d 2d 2d 0a 57 65 6c   ------------.Wel
0070  63 6f 6d 65 20 74 6f 20 74 68 65 20 32 34 31 20   come to the 241 
0080  53 65 72 76 65 72 0a 2d 2d 2d 2d 2d 2d 2d 2d 2d   Server.---------
0090  2d 2d 2d 2d 2d 2d 2d 2d 2d 2d 2d 2d 2d 2d 2d 2d   ----------------
00a0  2d 2d 2d 2d 2d 2d 2d 2d 2d 2d 2d 2d 2d 2d 2d 2d   ----------------
00b0  2d 2d 2d 0a 0a 0a 54 72 61 69 6e 69 6e 67 20 69   ---...Training i
00c0  6e 73 74 72 75 63 74 69 6f 6e 73 20 69 6e 20 74   nstructions in t
00d0  68 65 20 32 34 31 73 74 20 66 6f 72 75 6d 0a 54   he 241st forum.T
00e0  61 6b 65 20 63 61 72 65 2c 20 63 72 61 73 68 65   ake care, crashe
00f0  73 20 61 72 65 20 72 65 63 6f 72 64 65 64 2c 20   s are recorded, 
0100  0a 61 6e 64 20 70 65 6e 61 6c 74 69 65 73 20 61   .and penalties a
0110  72 65 20 67 69 76 65 6e 20 66 6f 72 20 6c 6f 73   re given for los
0120  74 20 61 69 72 63 72 61 66 74 21 00               t aircraft!.
    Data: 2c0000002000000000000000000000002a2a204c6f672d6f...
    [Length: 300]

No.     Time        Source                Destination           Protocol Info
     24 2.766136    192.168.1.3           192.168.1.2           TCP      45393 > 7910 [ACK] Seq=1375 Ack=1647 Win=10240 Len=0 TSV=4243584 TSER=4627068

Frame 24: 66 bytes on wire (528 bits), 66 bytes captured (528 bits)
